{
  "schema_version": 1,
  "fixture_set_id": "capability-surface-delta-fixtures-v1",
  "schema_ref": "schemas/capability-surface-delta.schema.json",
  "generated_from": [
    "cc-task-capability-freshness-remediation-and-discovery-automation-20260630",
    "cc-task-capability-status-vector-ssot-and-witness-contract-20260701"
  ],
  "declared_at": "2026-07-01T04:20:00Z",
  "descriptors": [
    {
      "descriptor_schema": 1,
      "surface_id": "route.glmcp.review.direct",
      "descriptor_ref": "platform-capability-registry:glmcp.review.direct",
      "surface_kind": "review_seat",
      "authority_ceiling": "read_only",
      "observed_at": "2026-07-01T04:00:00Z",
      "stale_after": "30m",
      "evidence_refs": ["platform-capability-receipt:glmcp:fixture"],
      "route_id": "glmcp.review.direct",
      "supply_leaf_id": "z_ai-glm-5.review.direct",
      "carrier_platform": "glmcp",
      "model_id": "z_ai-glm-5",
      "provider_id": "z_ai",
      "effort": "xhigh",
      "context_window": "large",
      "resource_pools": ["subscription_quota"],
      "tool_refs": ["hapax-glmcp-reviewer"],
      "harness_refs": ["review-seat-adapter"],
      "orchestration_child_refs": [],
      "privacy_sensitive": true,
      "public_egress": false,
      "money_rail": false
    }
  ],
  "deltas": [
    {
      "delta_schema": 1,
      "delta_id": "fixture:new-openrouter-slice",
      "source": "fixture",
      "observed_at": "2026-07-01T04:20:00Z",
      "detected_by": "capability-surface-delta-fixture",
      "surface_id": "route.openrouter.qwen3-coder.high",
      "delta_kind": "new_capability",
      "prior_descriptor_ref": null,
      "observed_descriptor_ref": "provider-catalog:openrouter:qwen3-coder:high",
      "evidence_refs": ["provider-catalog:openrouter:fixture"],
      "authority_ceiling": "frontier_review_required",
      "affected_resource_pools": ["api_paid_spend"],
      "privacy_sensitive": true,
      "public_egress": false,
      "money_rail": true,
      "freshness_state": "delta_pending",
      "required_intake_action": "mint_intake_item",
      "remediation_ref": "cc-task-capability-freshness-remediation-and-discovery-automation-20260630",
      "summary": "new paid provider slice observed and must enter governed intake"
    },
    {
      "delta_schema": 1,
      "delta_id": "fixture:stale-glmcp-quota",
      "source": "fixture",
      "observed_at": "2026-07-01T04:20:00Z",
      "detected_by": "capability-surface-delta-fixture",
      "surface_id": "route.glmcp.review.direct",
      "delta_kind": "stale_determination",
      "prior_descriptor_ref": "platform-capability-registry:glmcp.review.direct",
      "observed_descriptor_ref": "platform-capability-receipt:glmcp:expired",
      "evidence_refs": ["platform-capability-receipt:glmcp:expired"],
      "authority_ceiling": "read_only",
      "affected_resource_pools": ["subscription_quota"],
      "privacy_sensitive": true,
      "public_egress": false,
      "money_rail": false,
      "freshness_state": "stale",
      "required_intake_action": "refresh_receipt",
      "remediation_ref": "cc-task-capability-freshness-remediation-and-discovery-automation-20260630",
      "summary": "glmcp quota determination is stale and cannot satisfy demand"
    },
    {
      "delta_schema": 1,
      "delta_id": "fixture:authority-change-publication-bus",
      "source": "fixture",
      "observed_at": "2026-07-01T04:20:00Z",
      "detected_by": "capability-surface-delta-fixture",
      "surface_id": "surface.publication_bus.weblog",
      "delta_kind": "authority_changed",
      "prior_descriptor_ref": "publication-bus:weblog:read-only",
      "observed_descriptor_ref": "publication-bus:weblog:publish-capable",
      "evidence_refs": ["publication-bus:wire-status:fixture"],
      "authority_ceiling": "frontier_review_required",
      "affected_resource_pools": ["public_egress"],
      "privacy_sensitive": true,
      "public_egress": true,
      "money_rail": false,
      "freshness_state": "delta_pending",
      "required_intake_action": "update_descriptor",
      "remediation_ref": "cc-task-capability-freshness-remediation-and-discovery-automation-20260630",
      "summary": "publication bus authority changed and requires descriptor update"
    }
  ]
}
